{
  "schema_version": "agent-council-output/v1",
  "council_id": "emergency-compounding-phase-results-2026-05-23",
  "generated_at": "2026-05-23T03:40:00Z",
  "project_context": {
    "project_name": "AI_Tool",
    "current_workstream": "Decision Intelligence V3",
    "planning_topic": "Replace the microscopic phase roadmap with a compounding-results roadmap where every unit creates obvious user-visible value.",
    "context_summary": "Decision Intelligence V3 has completed reliability fields, semantic metadata, semantic frame completion, correction actions, ranked observational evidence, chat continuity, truthfulness hardening, and frontend rendering for recent backend slices. The active docs currently point to Phase 4 Canonical Active Dataset Contract as the next item. The exported workspace result supplied by the user is critical contrary evidence: it produced pages of readiness labels, repeated prompt text, capability boundaries, guardrails, and internal structure, but no obvious business value, quantified insight, scenario comparison, visual decision outcome, or share-worthy export. The council therefore rejects a hidden-contract-first roadmap as the organizing model and recommends outcome units centered on decision briefs, quantified evidence, scenario comparison, visual decision outcomes, and executive-ready exports while preserving truthful capability boundaries.",
    "active_constraints": [
      "Codex owns backend logic, contracts, tests, architecture, review, and active markdown coordination.",
      "Gemini owns frontend implementation unless the user explicitly authorizes Codex frontend edits in the current session.",
      "Current runtime must not imply fake simulation, optimization, causal inference, autonomous decisioning, or final recommendations.",
      "Observational analysis remains the truth boundary until backend contracts, data prerequisites, and validation support stronger capability.",
      "Every future implementation unit must have an obvious visible result in the app or an exportable artifact before it is considered complete.",
      "Phase 4 dataset work is demoted from standalone hidden-contract priority unless it directly enables visible dataset trust inside a user-valued decision workflow."
    ]
  },
  "sources_reviewed": [
    {
      "path": "project_docs/INDEX.md",
      "source_type": "markdown",
      "relevance": "Routes agents to active truth, current roadmap, council workflow, and compounding-results council topic.",
      "reviewed_by": [
        "architecture-guardian",
        "implementation-planner"
      ]
    },
    {
      "path": "project_docs/active/README.md",
      "source_type": "markdown",
      "relevance": "Defines current status, scan rules, Phase 4 active-next framing, and emergency compounding-results council location.",
      "reviewed_by": [
        "architecture-guardian",
        "product-ux-strategist",
        "implementation-planner"
      ]
    },
    {
      "path": "project_docs/active/status/decision_intelligence_execution_status.md",
      "source_type": "status",
      "relevance": "Establishes completed Phase 1 through Phase 3 work, current Phase 4 dataset-contract priority, frontend build status, and verified capability boundaries.",
      "reviewed_by": [
        "architecture-guardian",
        "decision-intelligence-specialist",
        "data-ml-readiness-specialist",
        "skeptic-qa-reviewer"
      ]
    },
    {
      "path": "project_docs/active/rules/CODEX_FRONTEND_GUARDRAIL_READ_FIRST.md",
      "source_type": "markdown",
      "relevance": "Preserves Codex/Gemini ownership split and review behavior for frontend handoffs.",
      "reviewed_by": [
        "architecture-guardian",
        "implementation-planner"
      ]
    },
    {
      "path": "project_docs/active/decision_intelligence/current/next_focus_execution_plan.md",
      "source_type": "markdown",
      "relevance": "Contains the current microscopic phase roadmap and Phase 4 canonical active dataset sequencing challenged by this council.",
      "reviewed_by": [
        "product-ux-strategist",
        "decision-intelligence-specialist",
        "data-ml-readiness-specialist",
        "implementation-planner"
      ]
    },
    {
      "path": "project_docs/active/ai_hand_off/README.md",
      "source_type": "handoff",
      "relevance": "Defines active Codex/Gemini handoff structure and ownership rules that the new roadmap must preserve.",
      "reviewed_by": [
        "architecture-guardian",
        "implementation-planner"
      ]
    },
    {
      "path": "project_docs/active/ai_hand_off/phase_4_gemini_frontend_canonical_active_dataset.md",
      "source_type": "handoff",
      "relevance": "Shows Phase 4 is currently framed as frontend state and dataset visibility alignment, useful but insufficient as a standalone high-value outcome.",
      "reviewed_by": [
        "product-ux-strategist",
        "data-ml-readiness-specialist",
        "skeptic-qa-reviewer"
      ]
    },
    {
      "path": "project_docs/active/contracts/decision_objects.md",
      "source_type": "contract",
      "relevance": "Documents existing DecisionBrief, DecisionSignal, Scenario, DecisionScenarioPreview, ranked diagnostics, readiness, and dataset summary contracts that can be reorganized into visible product workflows.",
      "reviewed_by": [
        "architecture-guardian",
        "decision-intelligence-specialist",
        "data-ml-readiness-specialist"
      ]
    },
    {
      "path": "project_docs/active/agent_council/outputs/compounding-phase-results/README.md",
      "source_type": "markdown",
      "relevance": "Defines the emergency council topic and the requirement to restructure work around compounding visible product results.",
      "reviewed_by": [
        "product-ux-strategist",
        "implementation-planner",
        "skeptic-qa-reviewer"
      ]
    },
    {
      "path": "user-provided exported workspace result evidence from 2026-05-22 request",
      "source_type": "other",
      "relevance": "Critical user evidence that current output is technically dense but low-value: readiness labels, repeated prompt text, capability boundaries, guardrails, and internal structure without quantified insight, scenario comparison, visual decision outcome, or share-worthy export.",
      "reviewed_by": [
        "product-ux-strategist",
        "decision-intelligence-specialist",
        "skeptic-qa-reviewer"
      ]
    }
  ],
  "participating_agents": [
    {
      "agent_id": "architecture-guardian",
      "role_name": "Architecture Guardian",
      "perspective": "Protect explicit backend-owned truth, stable contracts, and honest capability boundaries while allowing the roadmap to stop over-optimizing hidden fields.",
      "decision_rights": "Can block proposals that require fake capabilities, frontend-only inference, hidden coupling, or contract claims not supported by backend behavior."
    },
    {
      "agent_id": "product-ux-strategist",
      "role_name": "Product/UX Strategist",
      "perspective": "Prioritize workflows users can see, understand, export, and value without reading docs or inspecting raw contracts.",
      "decision_rights": "Can veto work units whose completion evidence is only tests, docs, hidden fields, or debug-like UI."
    },
    {
      "agent_id": "decision-intelligence-specialist",
      "role_name": "Decision Intelligence Specialist",
      "perspective": "Keep the product centered on decision framing, quantified evidence, trade-off thinking, guardrails, assumptions, and structured insight loops.",
      "decision_rights": "Can require every visible outcome to improve the decision workflow rather than generic chat or dataset polish."
    },
    {
      "agent_id": "data-ml-readiness-specialist",
      "role_name": "Data/ML Readiness Specialist",
      "perspective": "Protect dataset truth, statistical validity, scenario assumptions, readiness gates, leakage awareness, and the line between observational evidence and unsupported prediction.",
      "decision_rights": "Can defer Monte Carlo, causal claims, forecasting, or optimization until prerequisites and validation are explicit."
    },
    {
      "agent_id": "skeptic-qa-reviewer",
      "role_name": "Skeptic/QA Reviewer",
      "perspective": "Attack vague acceptance criteria, happy-path demos, stale state, low-value outputs, and unverified user-visible behavior.",
      "decision_rights": "Can reject a work unit as incomplete when the visible result is not obvious or export quality is not proven."
    },
    {
      "agent_id": "implementation-planner",
      "role_name": "Implementation Planner",
      "perspective": "Convert the debate into a practical Codex/Gemini sequence with entry criteria, exit criteria, validation paths, and doc updates.",
      "decision_rights": "Can sequence recommendations and assign Codex versus Gemini ownership."
    }
  ],
  "conversation_rounds": {
    "round_1_independent_proposals": [
      {
        "agent_id": "architecture-guardian",
        "stance": "Keep truthful contracts, but stop treating hidden additive fields as product outcomes.",
        "claims": [
          "The existing backend contract work is useful infrastructure, but Phase 4 as a hidden canonical dataset contract will repeat the same value failure unless it is attached to a visible decision outcome.",
          "Dataset truth should become a visible prerequisite inside a decision brief and scenario comparison workflow, not an isolated phase that users experience as another label surface."
        ],
        "challenged_assumptions": [
          "A canonical active dataset contract is not automatically high-value just because many surfaces consume data.",
          "A backend field is not complete product work unless a user can see why it matters."
        ],
        "evidence": [
          "The active status says Phase 4 Canonical Active Dataset Contract is next.",